{
  "BackupId": "backup-abc1234567890def",
  "Lifecycle": "AVAILABLE",
  "Type": "USER_INITIATED",
  "CreationTime": "2025-06-01T02:00:00Z",
  "ResourceARN": "arn:aws:fsx:us-east-1:123456789012:backup/backup-abc1234567890def",
  "Tags": [
    {
      "Key": "BackupType",
      "Value": "PreMaintenance"
    }
  ],
  "OwnerId": "123456789012"
}